{
  "schema": "pose-lab-blend-archaeology-v1",
  "slug": "remhir",
  "source": {
    "filename": "Remhir.blend",
    "sha256": "ce670c397e3acad64c29a5b6498df3bd578f418a99b971f38c1d6634e6c0051b",
    "sourceDate": null,
    "blenderVersion": "2.77",
    "provenance": "recovered-source",
    "locationNote": "Conversation upload; 6,290,220 bytes. Blender header BLENDER-v277."
  },
  "identity": {
    "project": null,
    "subject": "Remhir / gargoyle player character",
    "role": "player character in an infinite minimalist combat game",
    "medium": "game"
  },
  "evidence": [
    {
      "status": "MEASURED",
      "claim": "The uploaded source is a Blender 2.77 .blend file with SHA-256 ce670c397e3acad64c29a5b6498df3bd578f418a99b971f38c1d6634e6c0051b and size 6,290,220 bytes.",
      "source": "conversation upload / container byte inspection",
      "confidence": 1.0
    },
    {
      "status": "USER_MEMORY",
      "claim": "The player character is a gargoyle whose core interaction was punch, punch, counter.",
      "source": "Drew, 2026-09-14",
      "confidence": 1.0
    },
    {
      "status": "USER_MEMORY",
      "claim": "The game was infinite, highly minimalist, and remembered as one of the most fun / best games Drew had made at the time or ever.",
      "source": "Drew, 2026-09-14",
      "confidence": 1.0
    },
    {
      "status": "USER_MEMORY",
      "claim": "This was one of Drew's early characters where punch-based combat replaced his earlier sword-first instinct.",
      "source": "Drew, 2026-09-14",
      "confidence": 1.0
    }
  ],
  "inventory": {
    "scenes": [],
    "collections": [],
    "armatures": [],
    "actions": [],
    "cameras": [],
    "notableObjects": [],
    "notableConstraints": [],
    "notableModifiers": []
  },
  "productionMethod": {
    "kind": "unknown",
    "notes": "Pending Blender-source inspection."
  },
  "motionGrammar": {
    "verbs": ["PUNCH", "PUNCH", "COUNTER"],
    "worldLaws": ["Pending source inspection"],
    "invariants": [],
    "channels": ["BODY", "GAMEPLAY_STATE", "TIMING"],
    "timingCharacter": "Pending source inspection.",
    "squashStretch": null,
    "recoveryLaw": null
  },
  "lessons": [
    {
      "mechanism": "A tiny combat verb set may sustain an infinite game when each input produces a strong state change and counterplay matters more than move-count variety.",
      "evidence": "USER_MEMORY only until source and gameplay evidence are inspected.",
      "consequence": "Test minimalist punch/counter loops as first-class combat designs instead of assuming content breadth is required for longevity.",
      "confidence": 0.55
    }
  ],
  "lineage": [
    {
      "direction": "ancestor-of",
      "target": "Gravity Fist",
      "relationship": "Possible early punch/counter design lineage preceding later Gravity Fist combat work.",
      "status": "USER_MEMORY",
      "confidence": 0.55
    }
  ],
  "summary": {
    "mechanism": "Intake only: infinite minimalist gargoyle combat remembered as punch, punch, counter with unusually strong game feel.",
    "strongestLesson": "Minimal verb count may increase rather than reduce expressive game feel when the verbs sharply change tactical state.",
    "futureUse": "Inspect actions, timing, silhouettes, counters, and loop reset in the source before promoting the lesson beyond memory evidence.",
    "confidence": 0.55
  }
}
