{
  "schema": "pose-lab-blend-archaeology-v1",
  "slug": "replace-me",
  "source": {
    "filename": "replace-me.blend",
    "sha256": null,
    "sourceDate": null,
    "blenderVersion": null,
    "provenance": "unknown",
    "locationNote": null
  },
  "identity": {
    "project": null,
    "subject": null,
    "role": null,
    "medium": "unknown"
  },
  "evidence": [],
  "inventory": {
    "scenes": [],
    "collections": [],
    "armatures": [],
    "actions": [],
    "cameras": [],
    "notableObjects": [],
    "notableConstraints": [],
    "notableModifiers": []
  },
  "productionMethod": {
    "kind": "unknown",
    "notes": null
  },
  "motionGrammar": {
    "verbs": ["UNKNOWN"],
    "worldLaws": [],
    "invariants": [],
    "channels": [],
    "timingCharacter": null,
    "squashStretch": null,
    "recoveryLaw": null
  },
  "lessons": [
    {
      "mechanism": "Pending inspection.",
      "evidence": "Pending inspection.",
      "consequence": "Pending inspection.",
      "confidence": 0.0
    }
  ],
  "lineage": [],
  "summary": {
    "mechanism": "Pending inspection.",
    "strongestLesson": "Pending inspection.",
    "futureUse": "Pending inspection.",
    "confidence": 0.0
  }
}
